{
  "slug": "urban-lite-360-2026",
  "title_zh": "Urban Lite 360 城市轻便童车评测",
  "title_en": "Urban Lite 360 City Stroller Review",
  "summary_zh": "Urban Lite 360 在城市路面推行顺滑，折叠后体积小，适合高频通勤家庭。",
  "summary_en": "Urban Lite 360 is smooth on city roads and folds into a compact size, ideal for frequent commuting families.",
  "age_range": "6 months - 4 years",
  "weight_range": "0-22kg",
  "source_url": "https://example.com/urban-lite-360-spec",
  "source_note": "Brand specification page and user manual",
  "needs_verification": true,
  "verified_at": "2026-05-12"
}
